"No.","Time","Source","Destination","Protocol","Length","Info"
"1","0.000000","192.168.0.22","192.168.10.101","TCP","66","64278  >  7680 [SYN] Seq=0 Win=64240 Len=0 MSS=1460 WS=256 SACK_PERM"
"2","-0.000001","192.168.0.22","100.126.119.90","TCP","66","64277  >  7680 [SYN] Seq=0 Win=64240 Len=0 MSS=1460 WS=256 SACK_PERM"
"3","-0.000001","192.168.0.22","100.126.29.16","TCP","66","64276  >  7680 [SYN] Seq=0 Win=64240 Len=0 MSS=1460 WS=256 SACK_PERM"
"4","-0.000001","192.168.0.22","192.168.10.130","TCP","66","64275  >  7680 [SYN] Seq=0 Win=64240 Len=0 MSS=1460 WS=256 SACK_PERM"
"5","0.007868","27.86.45.169","192.168.0.22","ICMP","110","Destination unreachable (Communication administratively filtered)"
"6","0.305304","192.168.0.22","230.0.0.1","UDP","92","64439  >  6666 Len=50"
"7","1.317459","192.168.0.22","230.0.0.1","UDP","92","64439  >  6666 Len=50"
"8","2.003330","192.168.0.22","100.126.119.90","TCP","66","[TCP Retransmission] 64277  >  7680 [SYN] Seq=0 Win=64240 Len=0 MSS=1460 WS=256 SACK_PERM"
"9","2.003336","192.168.0.22","192.168.10.130","TCP","66","[TCP Retransmission] 64275  >  7680 [SYN] Seq=0 Win=64240 Len=0 MSS=1460 WS=256 SACK_PERM"
"10","2.003336","192.168.0.22","100.126.29.16","TCP","66","[TCP Retransmission] 64276  >  7680 [SYN] Seq=0 Win=64240 Len=0 MSS=1460 WS=256 SACK_PERM"
"11","2.003336","192.168.0.22","192.168.10.101","TCP","66","[TCP Retransmission] 64278  >  7680 [SYN] Seq=0 Win=64240 Len=0 MSS=1460 WS=256 SACK_PERM"
"12","2.307022","192.168.0.22","192.168.0.1","DNS","76","Standard query 0x170b A us05www3.zoom.us"
"13","2.321789","192.168.0.22","230.0.0.1","UDP","92","64439  >  6666 Len=50"
"14","2.337017","192.168.0.22","192.168.0.1","DNS","76","Standard query 0x170b A us05www3.zoom.us"
"15","2.338287","192.168.0.1","192.168.0.22","DNS","114","Standard query response 0x170b A us05www3.zoom.us CNAME us05web.zoom.us A 170.114.52.5"
"16","2.347479","192.168.0.22","170.114.52.5","TCP","66","64279  >  443 [SYN] Seq=0 Win=64240 Len=0 MSS=1460 WS=256 SACK_PERM"
"17","2.353672","170.114.52.5","192.168.0.22","TCP","66","443  >  64279 [SYN, ACK] Seq=0 Ack=1 Win=64240 Len=0 MSS=1420 SACK_PERM WS=8192"
"18","2.353801","192.168.0.22","170.114.52.5","TCP","54","64279  >  443 [ACK] Seq=1 Ack=1 Win=131840 Len=0"
"19","2.357992","192.168.0.22","170.114.52.5","TLSv1.3","571","Client Hello"
"20","2.364040","170.114.52.5","192.168.0.22","TCP","54","443  >  64279 [ACK] Seq=1 Ack=518 Win=57344 Len=0"
"21","2.537283","170.114.52.5","192.168.0.22","TLSv1.3","1474","Server Hello, Change Cipher Spec"
"22","2.537283","170.114.52.5","192.168.0.22","TCP","682","443  >  64279 [PSH, ACK] Seq=1421 Ack=518 Win=65536 Len=628 [TCP segment of a reassembled PDU]"
"23","2.537283","170.114.52.5","192.168.0.22","TCP","1474","443  >  64279 [ACK] Seq=2049 Ack=518 Win=65536 Len=1420 [TCP segment of a reassembled PDU]"
"24","2.537283","170.114.52.5","192.168.0.22","TLSv1.3","529","Application Data"
"25","2.537421","192.168.0.22","170.114.52.5","TCP","54","64279  >  443 [ACK] Seq=518 Ack=3944 Win=131840 Len=0"
"26","2.540218","192.168.0.22","170.114.52.5","TLSv1.3","134","Change Cipher Spec, Application Data"
"27","2.540453","192.168.0.22","170.114.52.5","TLSv1.3","3155","Application Data"
"28","2.541634","170.114.52.5","192.168.0.22","TCP","529","[TCP Spurious Retransmission] 443  >  64279 [PSH, ACK] Seq=3469 Ack=518 Win=65536 Len=475"
"29","2.541662","192.168.0.22","170.114.52.5","TCP","66","[TCP Dup ACK 25#1] 64279  >  443 [ACK] Seq=3699 Ack=3944 Win=131840 Len=0 SLE=3469 SRE=3944"
"30","2.546123","170.114.52.5","192.168.0.22","TCP","54","443  >  64279 [ACK] Seq=3944 Ack=598 Win=57344 Len=0"
"31","2.546973","170.114.52.5","192.168.0.22","TCP","54","443  >  64279 [ACK] Seq=3944 Ack=2018 Win=57344 Len=0"
"32","2.546973","170.114.52.5","192.168.0.22","TCP","54","443  >  64279 [ACK] Seq=3944 Ack=3699 Win=57344 Len=0"
"33","3.081921","170.114.52.5","192.168.0.22","TLSv1.3","1474","Application Data"
"34","3.081921","170.114.52.5","192.168.0.22","TLSv1.3","1474","Application Data"
"35","3.081921","170.114.52.5","192.168.0.22","TLSv1.3","478","Application Data"
"36","3.082126","192.168.0.22","170.114.52.5","TCP","54","64279  >  443 [ACK] Seq=3699 Ack=7208 Win=131840 Len=0"
"37","3.082316","170.114.52.5","192.168.0.22","TLSv1.3","1445","Application Data"
"38","3.082399","192.168.0.22","170.114.52.5","TCP","54","64279  >  443 [ACK] Seq=3699 Ack=8599 Win=130560 Len=0"
"39","3.082454","170.114.52.5","192.168.0.22","TLSv1.3","1474","Application Data"
"40","3.082454","170.114.52.5","192.168.0.22","TLSv1.3","1416","Application Data"
"41","3.082454","170.114.52.5","192.168.0.22","TLSv1.3","1474","Application Data"
"42","3.082529","192.168.0.22","170.114.52.5","TCP","54","64279  >  443 [ACK] Seq=3699 Ack=12801 Win=131840 Len=0"
"43","3.082675","170.114.52.5","192.168.0.22","TLSv1.3","1474","Application Data"
"44","3.082675","170.114.52.5","192.168.0.22","TLSv1.3","904","Application Data"
"45","3.082764","192.168.0.22","170.114.52.5","TCP","54","64279  >  443 [ACK] Seq=3699 Ack=15071 Win=131840 Len=0"
"46","3.276248","170.114.52.5","192.168.0.22","TLSv1.3","1474","Application Data"
"47","3.276248","170.114.52.5","192.168.0.22","TLSv1.3","1474","Application Data"
"48","3.276248","170.114.52.5","192.168.0.22","TCP","1310","443  >  64279 [PSH, ACK] Seq=17911 Ack=3699 Win=65536 Len=1256 [TCP segment of a reassembled PDU]"
"49","3.276406","192.168.0.22","170.114.52.5","TCP","54","64279  >  443 [ACK] Seq=3699 Ack=19167 Win=131840 Len=0"
"50","3.276529","170.114.52.5","192.168.0.22","TLSv1.3","1474","Application Data"
"51","3.276529","170.114.52.5","192.168.0.22","TLSv1.3","555","Application Data, Application Data, Application Data"
"52","3.276639","192.168.0.22","170.114.52.5","TCP","54","64279  >  443 [ACK] Seq=3699 Ack=21088 Win=131840 Len=0"
"53","3.328888","192.168.0.22","230.0.0.1","UDP","92","64439  >  6666 Len=50"
"54","3.465957","192.168.0.22","206.247.148.213","TCP","66","64282  >  443 [SYN] Seq=0 Win=64240 Len=0 MSS=1460 WS=256 SACK_PERM"
"55","3.466154","192.168.0.22","192.168.0.1","DNS","86","Standard query 0x6e68 AAAA zoomdcaii213zc.dca.zoom.us"
"56","3.466162","192.168.0.22","192.168.0.1","DNS","86","Standard query 0xa4a4 AAAA zoompaobn253zc.pao.zoom.us"
"57","3.466165","192.168.0.22","192.168.0.1","DNS","86","Standard query 0xd9ca AAAA zoomdcaih213zc.dca.zoom.us"
"58","3.466222","192.168.0.22","206.247.149.213","TCP","66","64283  >  443 [SYN] Seq=0 Win=64240 Len=0 MSS=1460 WS=256 SACK_PERM"
"59","3.466290","192.168.0.22","192.168.0.1","DNS","86","Standard query 0xe7b4 AAAA zoompaobm253zc.pao.zoom.us"
"60","3.466420","192.168.0.22","144.195.39.253","TCP","66","64284  >  443 [SYN] Seq=0 Win=64240 Len=0 MSS=1460 WS=256 SACK_PERM"
"61","3.466629","192.168.0.22","144.195.38.253","TCP","66","64285  >  443 [SYN] Seq=0 Win=64240 Len=0 MSS=1460 WS=256 SACK_PERM"
"62","3.467600","192.168.0.1","192.168.0.22","DNS","86","Standard query response 0x6e68 AAAA zoomdcaii213zc.dca.zoom.us"
"63","3.472604","192.168.0.1","192.168.0.22","DNS","171","Standard query response 0xa4a4 AAAA zoompaobn253zc.pao.zoom.us SOA ns-1403.awsdns-47.org"
"64","3.472863","192.168.0.1","192.168.0.22","DNS","173","Standard query response 0xd9ca AAAA zoomdcaih213zc.dca.zoom.us SOA ns-1777.awsdns-30.co.uk"
"65","3.473014","192.168.0.1","192.168.0.22","DNS","171","Standard query response 0xe7b4 AAAA zoompaobm253zc.pao.zoom.us SOA ns-1403.awsdns-47.org"
"66","3.594227","144.195.39.253","192.168.0.22","TCP","66","443  >  64284 [SYN, ACK] Seq=0 Ack=1 Win=42340 Len=0 MSS=1420 SACK_PERM WS=4096"
"67","3.594227","144.195.38.253","192.168.0.22","TCP","66","443  >  64285 [SYN, ACK] Seq=0 Ack=1 Win=42340 Len=0 MSS=1420 SACK_PERM WS=4096"
"68","3.594467","192.168.0.22","144.195.39.253","TCP","54","64284  >  443 [ACK] Seq=1 Ack=1 Win=131840 Len=0"
"69","3.594540","192.168.0.22","144.195.38.253","TCP","54","64285  >  443 [ACK] Seq=1 Ack=1 Win=131840 Len=0"
"70","3.595027","192.168.0.22","144.195.39.253","TLSv1.3","571","Client Hello"
"71","3.595399","192.168.0.22","144.195.38.253","TLSv1.3","571","Client Hello"
"72","3.663535","206.247.149.213","192.168.0.22","TCP","66","443  >  64283 [SYN, ACK] Seq=0 Ack=1 Win=42340 Len=0 MSS=1420 SACK_PERM WS=4096"
"73","3.663535","206.247.148.213","192.168.0.22","TCP","66","443  >  64282 [SYN, ACK] Seq=0 Ack=1 Win=42340 Len=0 MSS=1420 SACK_PERM WS=4096"
"74","3.663679","192.168.0.22","206.247.149.213","TCP","54","64283  >  443 [ACK] Seq=1 Ack=1 Win=131840 Len=0"
"75","3.663727","192.168.0.22","206.247.148.213","TCP","54","64282  >  443 [ACK] Seq=1 Ack=1 Win=131840 Len=0"
"76","3.664022","192.168.0.22","206.247.149.213","TLSv1.3","571","Client Hello"
"77","3.664381","192.168.0.22","206.247.148.213","TLSv1.3","571","Client Hello"
"78","3.766012","144.195.39.253","192.168.0.22","TCP","54","443  >  64284 [ACK] Seq=1 Ack=518 Win=45056 Len=0"
"79","3.766012","144.195.39.253","192.168.0.22","TLSv1.3","153","Hello Retry Request, Change Cipher Spec"
"80","3.766012","144.195.38.253","192.168.0.22","TCP","54","443  >  64285 [ACK] Seq=1 Ack=518 Win=45056 Len=0"
"81","3.766012","144.195.38.253","192.168.0.22","TLSv1.3","153","Hello Retry Request, Change Cipher Spec"
"82","3.766369","192.168.0.22","144.195.39.253","TLSv1.3","577","Change Cipher Spec, Client Hello"
"83","3.766589","192.168.0.22","144.195.38.253","TLSv1.3","577","Change Cipher Spec, Client Hello"
"84","3.868431","206.247.149.213","192.168.0.22","TCP","54","443  >  64283 [ACK] Seq=1 Ack=518 Win=45056 Len=0"
"85","3.868431","206.247.149.213","192.168.0.22","TLSv1.3","153","Hello Retry Request, Change Cipher Spec"
"86","3.868431","206.247.148.213","192.168.0.22","TCP","54","443  >  64282 [ACK] Seq=1 Ack=518 Win=45056 Len=0"
"87","3.868431","206.247.148.213","192.168.0.22","TLSv1.3","153","Hello Retry Request, Change Cipher Spec"
"88","3.868883","192.168.0.22","206.247.149.213","TLSv1.3","577","Change Cipher Spec, Client Hello"
"89","3.869108","192.168.0.22","206.247.148.213","TLSv1.3","577","Change Cipher Spec, Client Hello"
"90","3.888920","144.195.39.253","192.168.0.22","TLSv1.3","1474","Server Hello, Application Data"
"91","3.889128","144.195.39.253","192.168.0.22","TCP","1474","443  >  64284 [ACK] Seq=1520 Ack=1041 Win=45056 Len=1420 [TCP segment of a reassembled PDU]"
"92","3.889208","192.168.0.22","144.195.39.253","TCP","54","64284  >  443 [ACK] Seq=1041 Ack=2940 Win=131840 Len=0"
"93","3.889299","144.195.39.253","192.168.0.22","TCP","1310","443  >  64284 [PSH, ACK] Seq=2940 Ack=1041 Win=45056 Len=1256 [TCP segment of a reassembled PDU]"
"94","3.890141","144.195.39.253","192.168.0.22","TLSv1.3","968","Application Data, Application Data, Application Data"
"95","3.890182","192.168.0.22","144.195.39.253","TCP","54","64284  >  443 [ACK] Seq=1041 Ack=5110 Win=131840 Len=0"
"96","3.892789","192.168.0.22","144.195.39.253","TLSv1.3","128","Application Data"
"97","3.892950","192.168.0.22","144.195.39.253","TLSv1.3","201","Application Data"
"98","3.894028","144.195.38.253","192.168.0.22","TLSv1.3","1474","Server Hello, Application Data"
"99","3.894235","144.195.38.253","192.168.0.22","TCP","1474","443  >  64285 [ACK] Seq=1520 Ack=1041 Win=45056 Len=1420 [TCP segment of a reassembled PDU]"
"100","3.894288","192.168.0.22","144.195.38.253","TCP","54","64285  >  443 [ACK] Seq=1041 Ack=2940 Win=131840 Len=0"
"101","3.894490","144.195.38.253","192.168.0.22","TCP","1310","443  >  64285 [PSH, ACK] Seq=2940 Ack=1041 Win=45056 Len=1256 [TCP segment of a reassembled PDU]"
"102","3.895142","144.195.38.253","192.168.0.22","TLSv1.3","968","Application Data, Application Data, Application Data"
"103","3.895183","192.168.0.22","144.195.38.253","TCP","54","64285  >  443 [ACK] Seq=1041 Ack=5110 Win=131840 Len=0"
"104","3.896909","192.168.0.22","144.195.38.253","TLSv1.3","128","Application Data"
"105","3.897044","192.168.0.22","144.195.38.253","TLSv1.3","201","Application Data"
"106","4.014367","144.195.39.253","192.168.0.22","TLSv1.3","133","Application Data"
"107","4.014367","144.195.39.253","192.168.0.22","TLSv1.3","133","Application Data"
"108","4.014465","192.168.0.22","144.195.39.253","TCP","54","64284  >  443 [ACK] Seq=1262 Ack=5268 Win=131840 Len=0"
"109","4.014569","144.195.39.253","192.168.0.22","TLSv1.3","122","Application Data"
"110","4.015002","192.168.0.22","144.195.39.253","TLSv1.3","1145","Application Data"
"111","4.073370","144.195.38.253","192.168.0.22","TLSv1.3","133","Application Data"
"112","4.073370","144.195.38.253","192.168.0.22","TLSv1.3","133","Application Data"
"113","4.073370","144.195.38.253","192.168.0.22","TLSv1.3","122","Application Data"
"114","4.073370","206.247.149.213","192.168.0.22","TLSv1.3","1474","Server Hello, Application Data"
"115","4.073370","206.247.149.213","192.168.0.22","TCP","1474","443  >  64283 [ACK] Seq=1520 Ack=1041 Win=45056 Len=1420 [TCP segment of a reassembled PDU]"
"116","4.073550","192.168.0.22","144.195.38.253","TCP","54","64285  >  443 [ACK] Seq=1262 Ack=5336 Win=131584 Len=0"
"117","4.073596","192.168.0.22","206.247.149.213","TCP","54","64283  >  443 [ACK] Seq=1041 Ack=2940 Win=131840 Len=0"
"118","4.073716","206.247.149.213","192.168.0.22","TCP","1310","443  >  64283 [PSH, ACK] Seq=2940 Ack=1041 Win=45056 Len=1256 [TCP segment of a reassembled PDU]"
"119","4.073716","206.247.149.213","192.168.0.22","TLSv1.3","972","Application Data, Application Data, Application Data"
"120","4.073716","206.247.148.213","192.168.0.22","TLSv1.3","1474","Server Hello, Application Data"
"121","4.073716","206.247.148.213","192.168.0.22","TCP","1474","443  >  64282 [ACK] Seq=1520 Ack=1041 Win=45056 Len=1420 [TCP segment of a reassembled PDU]"
"122","4.073716","206.247.148.213","192.168.0.22","TCP","1310","443  >  64282 [PSH, ACK] Seq=2940 Ack=1041 Win=45056 Len=1256 [TCP segment of a reassembled PDU]"
"123","4.073716","206.247.148.213","192.168.0.22","TLSv1.3","972","Application Data, Application Data, Application Data"
"124","4.073883","192.168.0.22","144.195.38.253","TLSv1.3","1145","Application Data"
"125","4.073985","192.168.0.22","206.247.149.213","TCP","54","64283  >  443 [ACK] Seq=1041 Ack=5114 Win=131840 Len=0"
"126","4.074011","192.168.0.22","206.247.148.213","TCP","54","64282  >  443 [ACK] Seq=1041 Ack=5114 Win=131840 Len=0"
"127","4.075862","192.168.0.22","206.247.149.213","TLSv1.3","128","Application Data"
"128","4.075999","192.168.0.22","206.247.149.213","TLSv1.3","201","Application Data"
"129","4.077788","192.168.0.22","206.247.148.213","TLSv1.3","128","Application Data"
"130","4.077921","192.168.0.22","206.247.148.213","TLSv1.3","201","Application Data"
"131","4.180089","144.195.39.253","192.168.0.22","TLSv1.3","933","Application Data"
"132","4.181526","192.168.0.22","206.247.148.213","TLSv1.3","78","Application Data"
"133","4.181738","192.168.0.22","206.247.148.213","TCP","54","64282  >  443 [FIN, ACK] Seq=1286 Ack=5114 Win=131840 Len=0"
"134","4.182077","192.168.0.22","206.247.149.213","TLSv1.3","78","Application Data"
"135","4.182160","192.168.0.22","206.247.149.213","TCP","54","64283  >  443 [FIN, ACK] Seq=1286 Ack=5114 Win=131840 Len=0"
"136","4.182468","192.168.0.22","144.195.38.253","TLSv1.3","88","Application Data"
"137","4.182557","192.168.0.22","144.195.38.253","TLSv1.3","78","Application Data"
"138","4.182638","192.168.0.22","144.195.38.253","TCP","54","64285  >  443 [FIN, ACK] Seq=2411 Ack=5336 Win=131584 Len=0"
"139","4.182989","192.168.0.22","144.195.39.253","TLSv1.3","88","Application Data"
"140","4.183064","192.168.0.22","144.195.39.253","TLSv1.3","78","Application Data"
"141","4.183113","192.168.0.22","144.195.39.253","TCP","54","64284  >  443 [FIN, ACK] Seq=2411 Ack=6215 Win=130816 Len=0"
"142","4.183154","192.168.0.22","192.168.0.1","DNS","86","Standard query 0x2d42 A zoompaobo79mmr.pao.zoom.us"
"143","4.189667","192.168.0.1","192.168.0.22","DNS","102","Standard query response 0x2d42 A zoompaobo79mmr.pao.zoom.us A 144.195.40.79"
"144","4.190640","192.168.0.22","144.195.40.79","TCP","66","64286  >  443 [SYN] Seq=0 Win=64240 Len=0 MSS=1460 WS=256 SACK_PERM"
"145","4.201748","144.195.38.253","192.168.0.22","TLSv1.3","941","Application Data"
"146","4.201860","192.168.0.22","144.195.38.253","TCP","54","64285  >  443 [RST, ACK] Seq=2412 Ack=6223 Win=0 Len=0"
"147","4.278066","206.247.149.213","192.168.0.22","TLSv1.3","133","Application Data"
"148","4.278066","206.247.149.213","192.168.0.22","TLSv1.3","133","Application Data"
"149","4.278066","206.247.149.213","192.168.0.22","TLSv1.3","122","Application Data"
"150","4.278066","206.247.148.213","192.168.0.22","TLSv1.3","133","Application Data"
"151","4.278066","206.247.148.213","192.168.0.22","TLSv1.3","133","Application Data"
"152","4.278167","192.168.0.22","206.247.149.213","TCP","54","64283  >  443 [RST, ACK] Seq=1287 Ack=5193 Win=0 Len=0"
"153","4.278281","192.168.0.22","206.247.148.213","TCP","54","64282  >  443 [RST, ACK] Seq=1287 Ack=5193 Win=0 Len=0"
"154","4.278343","206.247.148.213","192.168.0.22","TLSv1.3","122","Application Data"
"155","4.291441","192.168.0.22","192.168.0.1","DNS","86","Standard query 0x9187 AAAA zoompaobo79mmr.pao.zoom.us"
"156","4.298517","192.168.0.1","192.168.0.22","DNS","171","Standard query response 0x9187 AAAA zoompaobo79mmr.pao.zoom.us SOA ns-1403.awsdns-47.org"
"157","4.304644","144.195.39.253","192.168.0.22","TLSv1.3","78","Application Data"
"158","4.304644","144.195.39.253","192.168.0.22","TCP","54","443  >  64284 [RST, ACK] Seq=6239 Ack=2412 Win=49152 Len=0"
"159","4.304789","192.168.0.22","144.195.39.253","TCP","54","64284  >  443 [RST, ACK] Seq=2412 Ack=6239 Win=0 Len=0"
"160","4.309445","144.195.38.253","192.168.0.22","TLSv1.3","78","Application Data"
"161","4.309445","144.195.38.253","192.168.0.22","TCP","54","443  >  64285 [FIN, ACK] Seq=6247 Ack=2387 Win=49152 Len=0"
"162","4.309445","144.195.38.253","192.168.0.22","TCP","54","443  >  64285 [RST] Seq=5336 Win=0 Len=0"
"163","4.309445","144.195.38.253","192.168.0.22","TCP","54","443  >  64285 [RST] Seq=5336 Win=0 Len=0"
"164","4.315034","144.195.40.79","192.168.0.22","TCP","66","443  >  64286 [SYN, ACK] Seq=0 Ack=1 Win=42340 Len=0 MSS=1420 SACK_PERM WS=4096"
"165","4.315233","192.168.0.22","144.195.40.79","TCP","54","64286  >  443 [ACK] Seq=1 Ack=1 Win=131840 Len=0"
"166","4.316085","192.168.0.22","144.195.40.79","TLSv1.3","571","Client Hello"
"167","4.337323","192.168.0.22","230.0.0.1","UDP","92","64439  >  6666 Len=50"
"168","4.380656","206.247.149.213","192.168.0.22","TLSv1.3","78","Application Data"
"169","4.380656","206.247.149.213","192.168.0.22","TCP","54","443  >  64283 [FIN, ACK] Seq=5364 Ack=1287 Win=49152 Len=0"
"170","4.380656","206.247.148.213","192.168.0.22","TLSv1.3","78","Application Data"
"171","4.380656","206.247.148.213","192.168.0.22","TCP","54","443  >  64282 [FIN, ACK] Seq=5364 Ack=1287 Win=49152 Len=0"
"172","4.482715","144.195.40.79","192.168.0.22","TCP","54","443  >  64286 [ACK] Seq=1 Ack=518 Win=45056 Len=0"
"173","4.482715","144.195.40.79","192.168.0.22","TLSv1.3","153","Hello Retry Request, Change Cipher Spec"
"174","4.483092","192.168.0.22","144.195.40.79","TLSv1.3","577","Change Cipher Spec, Client Hello"
"175","4.608983","144.195.40.79","192.168.0.22","TLSv1.3","1474","Server Hello, Application Data"
"176","4.609168","144.195.40.79","192.168.0.22","TCP","1474","443  >  64286 [ACK] Seq=1520 Ack=1041 Win=45056 Len=1420 [TCP segment of a reassembled PDU]"
"177","4.609244","192.168.0.22","144.195.40.79","TCP","54","64286  >  443 [ACK] Seq=1041 Ack=2940 Win=131840 Len=0"
"178","4.609340","144.195.40.79","192.168.0.22","TCP","1310","443  >  64286 [PSH, ACK] Seq=2940 Ack=1041 Win=45056 Len=1256 [TCP segment of a reassembled PDU]"
"179","4.610163","144.195.40.79","192.168.0.22","TLSv1.3","968","Application Data, Application Data, Application Data"
"180","4.610204","192.168.0.22","144.195.40.79","TCP","54","64286  >  443 [ACK] Seq=1041 Ack=5110 Win=131840 Len=0"
"181","4.611962","192.168.0.22","144.195.40.79","TLSv1.3","128","Application Data"
"182","4.612150","192.168.0.22","144.195.40.79","TLSv1.3","203","Application Data"
"183","4.736817","144.195.40.79","192.168.0.22","TLSv1.3","133","Application Data"
"184","4.736817","144.195.40.79","192.168.0.22","TLSv1.3","133","Application Data"
"185","4.736817","144.195.40.79","192.168.0.22","TLSv1.3","122","Application Data"
"186","4.736924","192.168.0.22","144.195.40.79","TCP","54","64286  >  443 [ACK] Seq=1264 Ack=5336 Win=131584 Len=0"
"187","4.737487","192.168.0.22","144.195.40.79","TLSv1.3","3348","Application Data"
"188","4.892599","144.195.40.79","192.168.0.22","TCP","54","443  >  64286 [ACK] Seq=5336 Ack=4104 Win=53248 Len=0"
"189","4.892599","144.195.40.79","192.168.0.22","TLSv1.3","97","Application Data"
"190","4.892599","144.195.40.79","192.168.0.22","TCP","1474","443  >  64286 [ACK] Seq=5379 Ack=4558 Win=57344 Len=1420 [TCP segment of a reassembled PDU]"
"191","4.892599","144.195.40.79","192.168.0.22","TLSv1.3","769","Application Data"
"192","4.892599","144.195.40.79","192.168.0.22","TLSv1.3","213","Application Data"
"193","4.892599","144.195.40.79","192.168.0.22","TLSv1.3","173","Application Data"
"194","4.892599","144.195.40.79","192.168.0.22","TLSv1.3","1474","Application Data"
"195","4.892599","144.195.40.79","192.168.0.22","TLSv1.3","1434","Application Data"
"196","4.892599","144.195.40.79","192.168.0.22","TLSv1.3","115","Application Data"
"197","4.892599","144.195.40.79","192.168.0.22","TLSv1.3","115","Application Data"
"198","4.892599","144.195.40.79","192.168.0.22","TLSv1.3","115","Application Data"
"199","4.892870","192.168.0.22","144.195.40.79","TCP","54","64286  >  443 [ACK] Seq=4558 Ack=10775 Win=131840 Len=0"
"200","4.893034","192.168.0.22","144.195.40.79","TLSv1.3","97","Application Data"
"201","4.903086","192.168.0.22","144.195.40.79","TLSv1.3","126","Application Data"
"202","4.946074","192.168.0.22","144.195.40.79","TCP","66","64287  >  443 [SYN] Seq=0 Win=64240 Len=0 MSS=1460 WS=256 SACK_PERM"
"203","4.946259","192.168.0.22","144.195.40.79","TLSv1.3","393","Application Data"
"204","4.946356","192.168.0.22","144.195.40.79","TLSv1.3","316","Application Data"
"205","4.946469","192.168.0.22","144.195.40.79","TLSv1.3","329","Application Data"
"206","4.946541","192.168.0.22","144.195.40.79","TLSv1.3","282","Application Data"
"207","4.946664","192.168.0.22","144.195.40.79","TLSv1.3","270","Application Data"
"208","4.946766","192.168.0.22","144.195.40.79","TLSv1.3","291","Application Data"
"209","4.946867","192.168.0.22","144.195.40.79","TLSv1.3","236","Application Data"
"210","4.946954","192.168.0.22","144.195.40.79","TLSv1.3","271","Application Data"
"211","4.952515","192.168.0.22","144.195.40.79","TLSv1.3","254","Application Data"
"212","4.960040","192.168.0.22","170.114.15.96","TLSv1.2","459","Application Data"
"213","4.966690","192.168.0.22","144.195.40.79","TLSv1.3","353","Application Data"
"214","4.966991","192.168.0.22","144.195.40.79","TLSv1.3","291","Application Data"
"215","4.967188","192.168.0.22","144.195.40.79","TLSv1.3","277","Application Data"
"216","4.967364","192.168.0.22","144.195.40.79","TLSv1.3","277","Application Data"
"217","4.967524","192.168.0.22","144.195.40.79","TLSv1.3","271","Application Data"
"218","4.967668","192.168.0.22","144.195.40.79","TLSv1.3","354","Application Data"
"219","4.967822","192.168.0.22","144.195.40.79","TLSv1.3","352","Application Data"
"220","4.968010","192.168.0.22","144.195.40.79","TLSv1.3","280","Application Data"
"221","4.968138","192.168.0.22","144.195.40.79","TLSv1.3","1560","Application Data"
"222","4.968290","192.168.0.22","144.195.40.79","TLSv1.3","439","Application Data"
"223","4.968433","192.168.0.22","144.195.40.79","TLSv1.3","301","Application Data"
"224","4.968507","192.168.0.22","144.195.40.79","TLSv1.3","391","Application Data"
"225","4.968632","192.168.0.22","144.195.40.79","TLSv1.3","384","Application Data"
"226","4.968725","192.168.0.22","144.195.40.79","TLSv1.3","452","Application Data"
"227","4.968871","192.168.0.22","144.195.40.79","TLSv1.3","1474","Application Data"
"228","4.968999","192.168.0.22","144.195.40.79","TLSv1.3","740","Application Data"
"229","4.969134","192.168.0.22","144.195.40.79","TLSv1.3","304","Application Data"
"230","4.971954","192.168.0.22","144.195.40.79","TLSv1.3","481","Application Data"
"231","4.972153","192.168.0.22","144.195.40.79","TLSv1.3","521","Application Data"
"232","4.972337","192.168.0.22","144.195.40.79","TLSv1.3","326","Application Data"
"233","4.972431","192.168.0.22","144.195.40.79","TLSv1.3","432","Application Data"
"234","4.972559","192.168.0.22","144.195.40.79","TLSv1.3","366","Application Data"
"235","4.972712","192.168.0.22","144.195.40.79","TLSv1.3","447","Application Data"
"236","4.972838","192.168.0.22","144.195.40.79","TLSv1.3","280","Application Data"
"237","4.972973","192.168.0.22","144.195.40.79","TLSv1.3","245","Application Data"
"238","4.973052","192.168.0.22","144.195.40.79","TLSv1.3","336","Application Data"
"239","4.973170","192.168.0.22","144.195.40.79","TLSv1.3","338","Application Data"
"240","4.973244","192.168.0.22","144.195.40.79","TLSv1.3","352","Application Data"
"241","4.973368","192.168.0.22","144.195.40.79","TLSv1.3","437","Application Data"
"242","4.973489","192.168.0.22","144.195.40.79","TLSv1.3","441","Application Data"
"243","4.973626","192.168.0.22","144.195.40.79","TLSv1.3","437","Application Data"
"244","4.973761","192.168.0.22","144.195.40.79","TLSv1.3","441","Application Data"
"245","4.973884","192.168.0.22","144.195.40.79","TLSv1.3","437","Application Data"
"246","4.974005","192.168.0.22","144.195.40.79","TLSv1.3","441","Application Data"
"247","4.974125","192.168.0.22","144.195.40.79","TLSv1.3","437","Application Data"
"248","4.974258","192.168.0.22","144.195.40.79","TLSv1.3","441","Application Data"
"249","4.974397","192.168.0.22","144.195.40.79","TLSv1.3","1335","Application Data"
"250","4.974523","192.168.0.22","144.195.40.79","TLSv1.3","494","Application Data"
"251","4.974628","192.168.0.22","144.195.40.79","TLSv1.3","399","Application Data"
"252","5.021488","144.195.40.79","192.168.0.22","TLSv1.3","1474","Application Data, Application Data"
"253","5.021488","144.195.40.79","192.168.0.22","TLSv1.3","387","Application Data, Application Data, Application Data, Application Data"
"254","5.021680","192.168.0.22","144.195.40.79","TCP","54","64286  >  443 [ACK] Seq=23087 Ack=12528 Win=131840 Len=0"
"255","5.027690","144.195.40.79","192.168.0.22","TCP","54","443  >  64286 [ACK] Seq=12528 Ack=4673 Win=57344 Len=0"
"256","5.027779","192.168.0.22","144.195.40.79","TLSv1.3","512","Application Data"
"257","5.028145","144.195.40.79","192.168.0.22","TLSv1.3","97","Application Data"
"258","5.028145","144.195.40.79","192.168.0.22","TLSv1.3","126","Application Data"
"259","5.028231","192.168.0.22","144.195.40.79","TCP","54","64286  >  443 [ACK] Seq=23545 Ack=12643 Win=131840 Len=0"
"260","5.109363","144.195.40.79","192.168.0.22","TCP","66","443  >  64287 [SYN, ACK] Seq=0 Ack=1 Win=42340 Len=0 MSS=1420 SACK_PERM WS=4096"
"261","5.109481","192.168.0.22","144.195.40.79","TCP","54","64287  >  443 [ACK] Seq=1 Ack=1 Win=131840 Len=0"
"262","5.109900","192.168.0.22","144.195.40.79","TLSv1.3","571","Client Hello"
"263","5.120220","144.195.40.79","192.168.0.22","TCP","54","443  >  64286 [ACK] Seq=12643 Ack=5993 Win=65536 Len=0"
"264","5.120220","144.195.40.79","192.168.0.22","TLSv1.3","97","Application Data"
"265","5.120220","144.195.40.79","192.168.0.22","TCP","54","443  >  64286 [ACK] Seq=12686 Ack=6829 Win=65536 Len=0"
"266","5.120312","192.168.0.22","144.195.40.79","TLSv1.3","4314","Application Data, Application Data, Application Data, Application Data, Application Data, Application Data, Application Data, Application Data"
"267","5.120592","144.195.40.79","192.168.0.22","TCP","54","443  >  64286 [ACK] Seq=12686 Ack=8028 Win=65536 Len=0"
"268","5.120592","144.195.40.79","192.168.0.22","TCP","54","443  >  64286 [ACK] Seq=12686 Ack=8852 Win=65536 Len=0"
"269","5.120731","144.195.40.79","192.168.0.22","TCP","54","443  >  64286 [ACK] Seq=12686 Ack=10358 Win=65536 Len=0"
"270","5.120787","192.168.0.22","144.195.40.79","TLSv1.3","2894","Application Data, Application Data, Application Data, Application Data, Application Data"
"271","5.120906","192.168.0.22","144.195.40.79","TLSv1.3","2673","Application Data, Application Data, Application Data, Application Data, Application Data, Application Data, Application Data"
"272","5.121079","192.168.0.22","144.195.40.79","TLSv1.3","1129","Application Data"
"273","5.121214","144.195.40.79","192.168.0.22","TCP","54","443  >  64286 [ACK] Seq=12686 Ack=11657 Win=65536 Len=0"
"274","5.121214","144.195.40.79","192.168.0.22","TCP","54","443  >  64286 [ACK] Seq=12686 Ack=13475 Win=65536 Len=0"
"275","5.121216","192.168.0.22","144.195.40.79","TLSv1.3","333","Application Data"
"276","5.121782","144.195.40.79","192.168.0.22","TCP","54","443  >  64286 [ACK] Seq=12686 Ack=14411 Win=65536 Len=0"
"277","5.121782","144.195.40.79","192.168.0.22","TCP","54","443  >  64286 [ACK] Seq=12686 Ack=15305 Win=65536 Len=0"
"278","5.121782","144.195.40.79","192.168.0.22","TCP","54","443  >  64286 [ACK] Seq=12686 Ack=16886 Win=65536 Len=0"
"279","5.121782","144.195.40.79","192.168.0.22","TCP","54","443  >  64286 [ACK] Seq=12686 Ack=18324 Win=65536 Len=0"
"280","5.122340","144.195.40.79","192.168.0.22","TLSv1.3","354","Application Data"
"281","5.122340","144.195.40.79","192.168.0.22","TLSv1.3","240","Application Data"
"282","5.122340","144.195.40.79","192.168.0.22","TLSv1.3","240","Application Data"
"283","5.122340","144.195.40.79","192.168.0.22","TLSv1.3","372","Application Data, Application Data, Application Data, Application Data"
"284","5.122340","144.195.40.79","192.168.0.22","TCP","54","443  >  64286 [ACK] Seq=13676 Ack=20251 Win=65536 Len=0"
"285","5.122340","144.195.40.79","192.168.0.22","TCP","54","443  >  64286 [ACK] Seq=13676 Ack=21021 Win=65536 Len=0"
"286","5.122340","144.195.40.79","192.168.0.22","TCP","54","443  >  64286 [ACK] Seq=13676 Ack=22742 Win=65536 Len=0"
"287","5.122469","192.168.0.22","144.195.40.79","TLSv1.3","621","Application Data"
"288","5.122636","192.168.0.22","144.195.40.79","TLSv1.3","633","Application Data"
"289","5.122762","192.168.0.22","144.195.40.79","TLSv1.3","372","Application Data"
"290","5.122868","192.168.0.22","144.195.40.79","TLSv1.3","162","Application Data"
"291","5.122967","192.168.0.22","144.195.40.79","TLSv1.3","520","Application Data"
"292","5.131616","144.195.40.79","192.168.0.22","TLSv1.3","97","Application Data"
"293","5.131616","144.195.40.79","192.168.0.22","TLSv1.3","346","Application Data"
"294","5.131616","144.195.40.79","192.168.0.22","TLSv1.3","1474","Application Data, Application Data, Application Data, Application Data, Application Data, Application Data, Application Data, Application Data"
"295","5.131616","144.195.40.79","192.168.0.22","TLSv1.3","204","Application Data, Application Data"
"296","5.131764","192.168.0.22","144.195.40.79","TCP","54","64286  >  443 [ACK] Seq=36656 Ack=15581 Win=131840 Len=0"
"297","5.135702","192.168.0.22","144.195.40.79","TLSv1.3","97","Application Data"
"298","5.160880","192.168.0.22","144.195.40.79","TLSv1.3","551","Application Data"
"299","5.161230","192.168.0.22","144.195.40.79","TLSv1.3","377","Application Data"
"300","5.203139","170.114.15.96","192.168.0.22","TLSv1.2","490","Application Data"
"301","5.203139","144.195.40.79","192.168.0.22","TLSv1.3","97","Application Data"
"302","5.230073","144.195.40.79","192.168.0.22","TCP","54","443  >  64287 [ACK] Seq=1 Ack=518 Win=45056 Len=0"
"303","5.230073","144.195.40.79","192.168.0.22","TLSv1.3","153","Hello Retry Request, Change Cipher Spec"
"304","5.230714","192.168.0.22","144.195.40.79","TLSv1.3","577","Change Cipher Spec, Client Hello"
"305","5.245393","144.195.40.79","192.168.0.22","TCP","54","443  >  64286 [ACK] Seq=15624 Ack=26385 Win=65536 Len=0"
"306","5.246486","144.195.40.79","192.168.0.22","TCP","54","443  >  64286 [ACK] Seq=15624 Ack=29225 Win=65536 Len=0"
"307","5.246772","144.195.40.79","192.168.0.22","TCP","54","443  >  64286 [ACK] Seq=15624 Ack=32065 Win=65536 Len=0"
"308","5.246936","144.195.40.79","192.168.0.22","TCP","54","443  >  64286 [ACK] Seq=15624 Ack=34339 Win=65536 Len=0"
"309","5.247124","144.195.40.79","192.168.0.22","TCP","54","443  >  64286 [ACK] Seq=15624 Ack=35764 Win=65536 Len=0"
"310","5.247296","144.195.40.79","192.168.0.22","TCP","54","443  >  64286 [ACK] Seq=15624 Ack=36190 Win=65536 Len=0"
"311","5.248861","192.168.0.22","144.195.40.79","TLSv1.3","161","Application Data"
"312","5.248983","192.168.0.22","144.195.40.79","TLSv1.3","146","Application Data"
"313","5.249076","192.168.0.22","144.195.40.79","TLSv1.3","146","Application Data"
"314","5.249308","192.168.0.22","144.195.40.79","UDP","165","51549  >  8801 Len=123"
"315","5.249436","192.168.0.22","144.195.40.79","UDP","165","51550  >  8801 Len=123"
"316","5.253744","192.168.0.22","170.114.15.96","TCP","54","63787  >  443 [ACK] Seq=406 Ack=437 Win=513 Len=0"
"317","5.262150","192.168.0.22","144.195.40.79","TLSv1.3","146","Application Data"
"318","5.271517","192.168.0.22","144.195.40.79","TLSv1.3","146","Application Data"
"319","5.271688","192.168.0.22","144.195.40.79","TLSv1.3","146","Application Data"
"320","5.294255","192.168.0.22","144.195.40.79","TLSv1.3","118","Application Data"
"321","5.294433","192.168.0.22","144.195.40.79","TLSv1.3","137","Application Data"
"322","5.299001","192.168.0.22","144.195.40.79","TLSv1.3","551","Application Data"
"323","5.302166","144.195.40.79","192.168.0.22","TLSv1.3","97","Application Data"
"324","5.302166","144.195.40.79","192.168.0.22","TLSv1.3","121","Application Data"
"325","5.302166","144.195.40.79","192.168.0.22","TLSv1.3","150","Application Data"
"326","5.302166","144.195.40.79","192.168.0.22","TCP","54","443  >  64286 [ACK] Seq=15830 Ack=36699 Win=65536 Len=0"
"327","5.302291","192.168.0.22","144.195.40.79","TCP","54","64286  >  443 [ACK] Seq=38730 Ack=15830 Win=131584 Len=0"
"328","5.304237","192.168.0.22","144.195.40.79","TLSv1.3","133","Application Data"
"329","5.304373","192.168.0.22","144.195.40.79","TLSv1.3","265","Application Data"
"330","5.304485","192.168.0.22","144.195.40.79","TLSv1.3","271","Application Data"
"331","5.304592","192.168.0.22","144.195.40.79","TLSv1.3","268","Application Data"
"332","5.304709","192.168.0.22","144.195.40.79","TLSv1.3","267","Application Data"
"333","5.304822","192.168.0.22","144.195.40.79","TLSv1.3","265","Application Data"
"334","5.304928","192.168.0.22","144.195.40.79","TLSv1.3","271","Application Data"
"335","5.305034","192.168.0.22","144.195.40.79","TLSv1.3","183","Application Data"
"336","5.305137","192.168.0.22","144.195.40.79","TLSv1.3","183","Application Data"
"337","5.305245","192.168.0.22","144.195.40.79","TLSv1.3","157","Application Data"
"338","5.305348","192.168.0.22","144.195.40.79","TLSv1.3","156","Application Data"
"339","5.305455","192.168.0.22","144.195.40.79","TLSv1.3","165","Application Data"
"340","5.305517","192.168.0.22","144.195.40.79","TLSv1.3","165","Application Data"
"341","5.305621","192.168.0.22","144.195.40.79","TLSv1.3","140","Application Data"
"342","5.306173","192.168.0.22","144.195.40.79","UDP","165","51551  >  8801 Len=123"
"343","5.306310","192.168.0.22","144.195.40.79","UDP","165","51552  >  8801 Len=123"
"344","5.323701","144.195.40.79","192.168.0.22","TCP","54","443  >  64286 [ACK] Seq=15830 Ack=37519 Win=65536 Len=0"
"345","5.327150","144.195.40.79","192.168.0.22","TLSv1.3","97","Application Data"
"346","5.345718","192.168.0.22","144.195.40.79","UDP","165","51549  >  8801 Len=123"
"347","5.345846","192.168.0.22","144.195.40.79","UDP","165","51550  >  8801 Len=123"
"348","5.346262","144.195.40.79","192.168.0.22","TLSv1.3","1474","Server Hello, Application Data"
"349","5.348039","192.168.0.22","230.0.0.1","UDP","92","64439  >  6666 Len=50"
"350","5.348109","144.195.40.79","192.168.0.22","TCP","1474","443  >  64287 [ACK] Seq=1520 Ack=1041 Win=45056 Len=1420 [TCP segment of a reassembled PDU]"
"351","5.348109","144.195.40.79","192.168.0.22","TCP","1310","443  >  64287 [PSH, ACK] Seq=2940 Ack=1041 Win=45056 Len=1256 [TCP segment of a reassembled PDU]"
"352","5.348109","144.195.40.79","192.168.0.22","TLSv1.3","968","Application Data, Application Data, Application Data"
"353","5.348279","192.168.0.22","144.195.40.79","TCP","54","64287  >  443 [ACK] Seq=1041 Ack=5110 Win=131840 Len=0"
"354","5.350528","192.168.0.22","144.195.40.79","TLSv1.3","128","Application Data"
"355","5.350716","192.168.0.22","144.195.40.79","TLSv1.3","203","Application Data"
"356","5.378850","192.168.0.22","144.195.40.79","TCP","54","64286  >  443 [ACK] Seq=40863 Ack=15873 Win=131584 Len=0"
"357","5.403666","192.168.0.22","144.195.40.79","UDP","165","51551  >  8801 Len=123"
"358","5.403781","192.168.0.22","144.195.40.79","UDP","165","51552  >  8801 Len=123"
"359","5.409971","144.195.40.79","192.168.0.22","UDP","86","8801  >  51549 Len=44"
"360","5.409971","144.195.40.79","192.168.0.22","UDP","56","8801  >  51549 Len=14"
"361","5.409971","144.195.40.79","192.168.0.22","UDP","86","8801  >  51550 Len=44"
"362","5.409971","144.195.40.79","192.168.0.22","UDP","56","8801  >  51550 Len=14"
"363","5.409971","144.195.40.79","192.168.0.22","TCP","54","443  >  64286 [ACK] Seq=15873 Ack=37718 Win=65536 Len=0"
"364","5.409971","144.195.40.79","192.168.0.22","TLSv1.3","97","Application Data"
"365","5.409971","144.195.40.79","192.168.0.22","TLSv1.3","121","Application Data"
"366","5.409971","144.195.40.79","192.168.0.22","TLSv1.3","153","Application Data"
"367","5.409971","144.195.40.79","192.168.0.22","TLSv1.3","121","Application Data"
"368","5.409971","144.195.40.79","192.168.0.22","TLSv1.3","138","Application Data"
"369","5.409971","144.195.40.79","192.168.0.22","TLSv1.3","121","Application Data"
"370","5.410247","192.168.0.22","144.195.40.79","TCP","54","64286  >  443 [ACK] Seq=40863 Ack=16300 Win=131328 Len=0"
"371","5.410594","192.168.0.22","144.195.40.79","UDP","170","51549  >  8801 Len=128"
"372","5.410677","192.168.0.22","144.195.40.79","UDP","119","51550  >  8801 Len=77"
"373","5.420864","192.168.0.22","144.195.40.79","TLSv1.3","97","Application Data"
"374","5.441200","144.195.40.79","192.168.0.22","TCP","54","443  >  64286 [ACK] Seq=16300 Ack=38086 Win=65536 Len=0"
"375","5.441200","144.195.40.79","192.168.0.22","TCP","54","443  >  64286 [ACK] Seq=16300 Ack=38233 Win=65536 Len=0"
"376","5.441200","144.195.40.79","192.168.0.22","TCP","54","443  >  64286 [ACK] Seq=16300 Ack=38809 Win=65536 Len=0"
"377","5.441200","144.195.40.79","192.168.0.22","TCP","54","443  >  64286 [ACK] Seq=16300 Ack=39237 Win=65536 Len=0"
"378","5.441200","144.195.40.79","192.168.0.22","TCP","54","443  >  64286 [ACK] Seq=16300 Ack=39664 Win=65536 Len=0"
"379","5.441200","144.195.40.79","192.168.0.22","TCP","54","443  >  64286 [ACK] Seq=16300 Ack=40092 Win=65536 Len=0"
"380","5.441200","144.195.40.79","192.168.0.22","TCP","54","443  >  64286 [ACK] Seq=16300 Ack=40350 Win=65536 Len=0"
"381","5.441200","144.195.40.79","192.168.0.22","TCP","54","443  >  64286 [ACK] Seq=16300 Ack=40555 Win=65536 Len=0"
"382","5.441200","144.195.40.79","192.168.0.22","TCP","54","443  >  64286 [ACK] Seq=16300 Ack=40777 Win=65536 Len=0"
"383","5.441200","144.195.40.79","192.168.0.22","UDP","86","8801  >  51552 Len=44"
"384","5.441200","144.195.40.79","192.168.0.22","UDP","56","8801  >  51552 Len=14"
"385","5.441200","144.195.40.79","192.168.0.22","UDP","86","8801  >  51551 Len=44"
"386","5.441200","144.195.40.79","192.168.0.22","UDP","56","8801  >  51551 Len=14"
"387","5.441200","144.195.40.79","192.168.0.22","TLSv1.3","97","Application Data"
